/annunci/mercedes-benz-glb-200-x247-glb-200-d-automatic-4matic-premium-diesel-nero-1df362bc-2664-4974-9a4b-9308a5e9f525,Lynk & Co,2022-11-22 23:05:59.772992,"['https://prod.pictures.autoscout24.net/listing-images/1df362bc-2664-4974-9a4b-9308a5e9f525_4caf40cf-5884-4cee-bb96-b177930d50f4.jpg', 'https://prod.pictures.autoscout24.net/listing-images/1df362bc-2664-4974-9a4b-9308a5e9f525_8045aacb-4d0f-43b3-8699-9bdc21e5e522.jpg', 'https://prod.pictures.autoscout24.net/listing-images/1df362bc-2664-4974-9a4b-9308a5e9f525_d7d1995e-d245-4a53-a101-98ddc0e0caa0.jpg', 'https://prod.pictures.autoscout24.net/listing-images/1df362bc-2664-4974-9a4b-9308a5e9f525_b012f7af-32dc-4f3f-9761-aa1ad96eef60.jpg', 'https://prod.pictures.autoscout24.net/listing-images/1df362bc-2664-4974-9a4b-9308a5e9f525_9daa1e82-ef81-44f4-b0e5-9dc69c176e73.jpg', 'https://prod.pictures.autoscout24.net/listing-images/1df362bc-2664-4974-9a4b-9308a5e9f525_8562ebbd-c41a-45a6-ac8b-3d3d4932e158.jpg', 'https://prod.pictures.autoscout24.net/listing-images/1df362bc-2664-4974-9a4b-9308a5e9f525_94b3eddf-cda2-420d-9189-1bff19e00ec0.jpg', 'https://prod.pictures.autoscout24.net/listing-images/1df362bc-2664-4974-9a4b-9308a5e9f525_a14e88aa-3964-49d4-9f94-0f38f65daf6f.jpg', 'https://prod.pictures.autoscout24.net/listing-images/1df362bc-2664-4974-9a4b-9308a5e9f525_3c49f7f3-cbd6-4a06-99bd-22c4df5ed320.jpg', 'https://prod.pictures.autoscout24.net/listing-images/1df362bc-2664-4974-9a4b-9308a5e9f525_019b0edf-24c7-4365-a7a6-458694517e20.jpg', 'https://prod.pictures.autoscout24.net/listing-images/1df362bc-2664-4974-9a4b-9308a5e9f525_a75db8a8-6ae6-4351-958e-43179871c261.jpg', 'https://prod.pictures.autoscout24.net/listing-images/1df362bc-2664-4974-9a4b-9308a5e9f525_54da9365-cee4-4253-9a4c-6af4cb9ccf3a.jpg', 'https://prod.pictures.autoscout24.net/listing-images/1df362bc-2664-4974-9a4b-9308a5e9f525_afc97696-b0fd-453e-ad79-6f2f041a043e.jpg', 'https://prod.pictures.autoscout24.net/listing-images/1df362bc-2664-4974-9a4b-9308a5e9f525_a81a2ddd-76ed-4d3a-84a1-e9060df0126c.jpg', 'https://prod.pictures.autoscout24.net/listing-images/1df362bc-2664-4974-9a4b-9308a5e9f525_be461ca1-6c02-42da-acb9-add70288c268.jpg']",15,"Brescia, IT","5,2","6,2","4,6",S UV/Fuoristrada/Pick-up,Usato,4x4,5,5,,,80.507 km,02/2020,110 k W (150 C V),Automatico,,Euro 6,Climatizzatore Controllo automatico clima Cruise Control Sedile posteriore sdoppiato Sensore di pioggia Telecamera per parcheggio assistito,Autoradio,Airbag laterali Airbag passeggero Frenata d'emergenza assistita Riconoscimento dei segnali stradali Sistema di chiamata d'emergenza Sistema di controllo pressione pneumatici,Cerchi in lega Sedili sportivi,Nero,Grigio,Pelle parziale,"€ 0,-","€ 990,-","€ 0,-","€ 990,-",Kilometerleasing,10.000 km,48 Monate,"€ 264,45","3,82 %","3,49 % gebunden","€ 22.075,-",,1,,,1.950 cm³,8,4,,Metallizzato,"€ 12.693,60","1,13","€ 0,0817","€ 0,0467",6402460,Diesel,136 g/km (comb.),Nero,,,,,,,,2020,02/2024,,,,,,,,
/annunci/toyota-verso-toyota-verso-diesel-bianco-cf7a9f6a-84b6-45a3-b2d0-76e740c51a51,Lynk & Co,2022-11-22 23:06:00.375503,"['https://prod.pictures.autoscout24.net/listing-images/cf7a9f6a-84b6-45a3-b2d0-76e740c51a51_87febbf6-996f-4d42-a28c-dbb10865448a.jpg', 'https://prod.pictures.autoscout24.net/listing-images/cf7a9f6a-84b6-45a3-b2d0-76e740c51a51_de80b7c3-00ba-456a-9f8d-9fda0ac0adf9.jpg', 'https://prod.pictures.autoscout24.net/listing-images/cf7a9f6a-84b6-45a3-b2d0-76e740c51a51_4ff3ce61-0dea-4a52-b9f8-fe29aa0fe344.jpg', 'https://prod.pictures.autoscout24.net/listing-images/cf7a9f6a-84b6-45a3-b2d0-76e740c51a51_649325a3-ad9c-43e5-b8e7-a47dd6be56da.jpg', 'https://prod.pictures.autoscout24.net/listing-images/cf7a9f6a-84b6-45a3-b2d0-76e740c51a51_d731109e-a84a-4fe4-b6ce-a57ea5e22c30.jpg', 'https://prod.pictures.autoscout24.net/listing-images/cf7a9f6a-84b6-45a3-b2d0-76e740c51a51_2281262f-e18d-4a31-af17-707cd9e12e34.jpg', 'https://prod.pictures.autoscout24.net/listing-images/cf7a9f6a-84b6-45a3-b2d0-76e740c51a51_3d1e4576-a408-4117-a469-5235b176a9b0.jpg', 'https://prod.pictures.autoscout24.net/listing-images/cf7a9f6a-84b6-45a3-b2d0-76e740c51a51_a429a107-f537-4dbe-b1e4-3ca0f1728905.jpg', 'https://prod.pictures.autoscout24.net/listing-images/cf7a9f6a-84b6-45a3-b2d0-76e740c51a51_f159c8fa-4d8a-4311-805b-373912745f46.jpg', 'https://prod.pictures.autoscout24.net/listing-images/cf7a9f6a-84b6-45a3-b2d0-76e740c51a51_d483246d-5cc9-4f2f-878e-8c4c421d579c.jpg']",10,"roma, IT","4,9","5,9","4,4",Monovolume,Usato,,7,5,,,350.000 km,12/2013,91 k W (124 C V),Manuale,,Euro 5,360° camera Alzacristalli elettrici Bracciolo Climatizzatore Controllo automatico clima Cruise Control Hill Holder Sedile passeggero ribaltabile Sedile posteriore sdoppiato Sensore di luminosità Sensore di pioggia Sistema di navigazione Specchietti laterali elettrici Telecamera per parcheggio assistito Tetto panoramico Vetri oscurati Volante in pelle Volante multifunzione,Android Auto Autoradio Bluetooth CD Computer di bordo Funzione T VM P3 Sound system US BVivavoce,A BS Adaptive Cruise Control Airbag conducente Airbag laterali Airbag passeggero Airbag posteriore Airbag testa Antifurto Assistente abbaglianti Chiusura centralizzata Chiusura centralizzata telecomandata Controllo automatico trazione ES PFari L ED Fari bi-Xeno Fari di profondità antiabbagliamento Fendinebbia Frenata d'emergenza assistita Immobilizzatore elettronico Isofix Luci diurne Servosterzo Sistema di avviso di distanza,Cerchi in lega Sistema lavafari Touch screen,Bianco,Nero,,"€ 0,-","€ 1.090,-","€ 0,-","€ 1.090,-",Kilometerleasing,10.000 km,48 Monate,"€ 322,-","4,75 %","4,75 % gebunden","€ 29.149,-",,,,,1.998 cm³,6,4,1.560 kg,Metallizzato,"€ 15.456,-","0,97","€ 0,0797","€ 0,0321",,Diesel,129 g/km (comb.),,"€ 5.900,-",-,"€ 5.900,-","€ 7.307,15","9,15 %","7,71 %","€ 118,79",,,,,,,,,,
/annunci/abarth-595-1-4-t-jet-competizione-180cv-benzina-blu-azzurro-2e0def8a-cc2f-4380-9a74-f62cc9b58153,Lynk & Co,2022-11-22 23:06:01.694573,"['https://prod.pictures.autoscout24.net/listing-images/2e0def8a-cc2f-4380-9a74-f62cc9b58153_0676bd98-8929-4e04-b782-f856b5cba5eb.jpg', 'https://prod.pictures.autoscout24.net/listing-images/2e0def8a-cc2f-4380-9a74-f62cc9b58153_7b575296-e2c4-4fab-9eac-9587e1d766f9.jpg', 'https://prod.pictures.autoscout24.net/listing-images/2e0def8a-cc2f-4380-9a74-f62cc9b58153_43260c01-34f8-407e-9724-5684f04a9de4.jpg', 'https://prod.pictures.autoscout24.net/listing-images/2e0def8a-cc2f-4380-9a74-f62cc9b58153_1c4a99d6-afdd-4d6c-8055-1d4d2fcc307d.jpg', 'https://prod.pictures.autoscout24.net/listing-images/2e0def8a-cc2f-4380-9a74-f62cc9b58153_efe4bce7-0098-45c0-bfeb-dc3ac2e39cd7.jpg', 'https://prod.pictures.autoscout24.net/listing-images/2e0def8a-cc2f-4380-9a74-f62cc9b58153_2ca94294-5c26-48e7-aa9b-2e1ccfb78c93.jpg', 'https://prod.pictures.autoscout24.net/listing-images/2e0def8a-cc2f-4380-9a74-f62cc9b58153_8ac776d4-434e-411e-b8e3-3d17279cde48.jpg', 'https://prod.pictures.autoscout24.net/listing-images/2e0def8a-cc2f-4380-9a74-f62cc9b58153_42ef6300-7fd3-402a-acfa-1def8d90cebc.jpg', 'https://prod.pictures.autoscout24.net/listing-images/2e0def8a-cc2f-4380-9a74-f62cc9b58153_50afc8b3-104d-4d67-8321-3b145c47529a.jpg', 'https://prod.pictures.autoscout24.net/listing-images/2e0def8a-cc2f-4380-9a74-f62cc9b58153_dc5d323b-9c2e-4c18-a107-bfa4ab2324c8.jpg', 'https://prod.pictures.autoscout24.net/listing-images/2e0def8a-cc2f-4380-9a74-f62cc9b58153_5961a597-71e4-48a6-ad9d-6a7a83601d4f.jpg', 'https://prod.pictures.autoscout24.net/listing-images/2e0def8a-cc2f-4380-9a74-f62cc9b58153_1d2cb037-67c1-4f7c-82fb-65b5b5bdaa51.jpg', 'https://prod.pictures.autoscout24.net/listing-images/2e0def8a-cc2f-4380-9a74-f62cc9b58153_d6caf2b8-677a-401f-a28f-13bc8443faa3.jpg', 'https://prod.pictures.autoscout24.net/listing-images/2e0def8a-cc2f-4380-9a74-f62cc9b58153_a5749bd9-be54-4813-8e56-e35c6e5fc11b.jpg', 'https://prod.pictures.autoscout24.net/listing-images/2e0def8a-cc2f-4380-9a74-f62cc9b58153_db045499-6dae-4190-8607-d6c89a67c8c4.jpg']",15,"pesaro, IT",,,,City car,Usato,,4,3,Italia,,20.000 km,01/2022,132 k W (179 C V),Manuale,,Euro 6d,Climatizzatore Controllo automatico clima Sedile posteriore sdoppiato Specchietti laterali elettrici Tettuccio apribile Vetri oscurati Volante in pelle,Android Auto Apple Car Play Autoradio MP3 Schermo multifunzione interamente digitale Sound system,Airbag conducente Airbag laterali Airbag passeggero Airbag testa ES PFari Xenon Fendinebbia Luci diurne Sistema di controllo pressione pneumatici,Cerchi in lega Sospensioni sportive Specchietto retrovisore con funzione antiabbagliamento Touch screen,Blu/Azzurro,Nero,Alcantara,"€ 0,-",Enthalten,"€ 150,-","€ 150,-",Kilometerleasing,10.000 km,36 Monate,"€ 630,-","4,53 %","4,53 % gebunden","€ 47.880,-",,,Sì,,1.368 cm³,5,4,1.140 kg,Metallizzato,"€ 22.680,-","2,78","€ 0,0916","€ 0,0417",,Benzina,156 g/km (comb.),,"€ 27.500,-",-,"€ 27.500,-","€ 34.041,-","9,11 %","8,50 %","€ 564,20",,,,,,,,,,
/annunci/audi-sq5-sportback-3-0-tdi-mhev-48v-quattro-tiptronic-elettrica-diesel-grigio-1f688524-a376-451c-b419-ee27045c758e,Lynk & Co,2022-11-22 23:06:02.535636,"['https://prod.pictures.autoscout24.net/listing-images/1f688524-a376-451c-b419-ee27045c758e_91e5af88-ca24-4ad2-93e4-e48fd2b5a02b.jpg', 'https://prod.pictures.autoscout24.net/listing-images/1f688524-a376-451c-b419-ee27045c758e_bf3bc7ab-75e3-433c-aa84-7f72e9657f15.jpg', 'https://prod.pictures.autoscout24.net/listing-images/1f688524-a376-451c-b419-ee27045c758e_2fef14ad-9134-4802-86f3-88ef63ab6793.jpg', 'https://prod.pictures.autoscout24.net/listing-images/1f688524-a376-451c-b419-ee27045c758e_7ce2fc3a-d008-4614-9c92-da53c3f6f837.jpg', 'https://prod.pictures.autoscout24.net/listing-images/1f688524-a376-451c-b419-ee27045c758e_2acc1930-f62c-463e-aeff-8b6558c5829d.jpg', 'https://prod.pictures.autoscout24.net/listing-images/1f688524-a376-451c-b419-ee27045c758e_39253fe1-066c-427c-ab7f-4ac41bec2b7f.jpg', 'https://prod.pictures.autoscout24.net/listing-images/1f688524-a376-451c-b419-ee27045c758e_f1a1ea14-3ebb-4a9f-a650-db48a3689b6e.jpg', 'https://prod.pictures.autoscout24.net/listing-images/1f688524-a376-451c-b419-ee27045c758e_aee983c5-8891-49b3-a27b-d13bcc525dc1.jpg', 'https://prod.pictures.autoscout24.net/listing-images/1f688524-a376-451c-b419-ee27045c758e_459f61d9-61dd-4209-8fb7-a221c2abbb52.jpg', 'https://prod.pictures.autoscout24.net/listing-images/1f688524-a376-451c-b419-ee27045c758e_bb89762b-5ac8-41df-a896-c99a1efb4272.jpg', 'https://prod.pictures.autoscout24.net/listing-images/1f688524-a376-451c-b419-ee27045c758e_f2789cfb-b4f0-46fc-9998-8b76773b05d4.jpg', 'https://prod.pictures.autoscout24.net/listing-images/1f688524-a376-451c-b419-ee27045c758e_2d5b1a53-c325-4992-9331-3cfe12eb7250.jpg', 'https://prod.pictures.autoscout24.net/listing-images/1f688524-a376-451c-b419-ee27045c758e_8f537efd-537b-4180-b7f9-e3511d260a4a.jpg', 'https://prod.pictures.autoscout24.net/listing-images/1f688524-a376-451c-b419-ee27045c758e_96c2c46c-92fe-46b4-afd9-bcd1fba0d44b.jpg', 'https://prod.pictures.autoscout24.net/listing-images/1f688524-a376-451c-b419-ee27045c758e_581566ac-c405-4f06-84d3-c7fbc8d3baa5.jpg']",15,"Roma - RM, IT",,,,S UV/Fuoristrada/Pick-up,Usato,4x4,5,5,,24 mesi,100 km,11/2022,251 k W (341 C V),Automatico,Corrente elettrica ,,"Alzacristalli elettrici Bracciolo Chiusura centralizzata senza chiave Climatizzatore automatico, 3 zone Head-up display Hill Holder Portellone posteriore elettrico Regolazione elettrica sedili Sedile posteriore sdoppiato Sedili riscaldati Sensore di luminosità Sensore di pioggia Sensori di parcheggio assistito anteriori Sensori di parcheggio assistito posteriori Sistema di navigazione Specchietti laterali elettrici Start/Stop Automatico Supporto lombare Telecamera per parcheggio assistito Tetto panoramico Vetri oscurati Volante in pelle Volante multifunzione",Android Auto Apple Car Play Autoradio Autoradio digitale Bluetooth Carica per smartphone a induzione Computer di bordo MP3 Schermo multifunzione interamente digitale Sound system Streaming musicale integrato US BVivavoce,A BS Adaptive Cruise Control Airbag conducente Airbag laterali Airbag passeggero Airbag testa Antifurto Assistente abbaglianti Blind spot monitor Controllo elettronico della corsia ES PFari full-L ED Frenata d'emergenza assistita Immobilizzatore elettronico Isofix Limitatore di velocità Riconoscimento dei segnali stradali Servosterzo Sistema di avviso di distanza Sistema di chiamata d'emergenza Sistema di controllo pressione pneumatici,"Cerchi in lega (20"")Controllo vocale Freno di stazionamento elettrico Leve al volante Pacchetto invernale Pacchetto sportivo Sedili sportivi Sospensioni sportive Specchietto retrovisore con funzione antiabbagliamento Spoiler Tendalino Touch screen",Grigio,Nero,Pelle parziale,,,,,,,,,,,,,,,,2.967 cm³,8,6,2.085 kg,,,,,,,,,,,,,,,,,,,,,,,,,,
/annunci/opel-vivaro-diesel-bianco-50fd0c80-2d75-4bca-8ccd-85630454a9ef,Lynk & Co,2022-11-22 23:06:03.167465,"['https://prod.pictures.autoscout24.net/listing-images/50fd0c80-2d75-4bca-8ccd-85630454a9ef_c68246bc-4def-4712-ad9e-08e89f126a08.jpg', 'https://prod.pictures.autoscout24.net/listing-images/50fd0c80-2d75-4bca-8ccd-85630454a9ef_a0f4c0ca-850c-4c7a-9fdb-13f867a76a8d.jpg', 'https://prod.pictures.autoscout24.net/listing-images/50fd0c80-2d75-4bca-8ccd-85630454a9ef_b4881f9d-c695-4cc8-9359-f772f45e3e7b.jpg', 'https://prod.pictures.autoscout24.net/listing-images/50fd0c80-2d75-4bca-8ccd-85630454a9ef_d92c77fd-edaa-4b19-a139-15d6443820c0.jpg', 'https://prod.pictures.autoscout24.net/listing-images/50fd0c80-2d75-4bca-8ccd-85630454a9ef_4ee61764-2edc-4ecf-9296-af5e7f905cca.jpg', 'https://prod.pictures.autoscout24.net/listing-images/50fd0c80-2d75-4bca-8ccd-85630454a9ef_d1b354e3-0b0d-429c-9c3d-36809c367452.jpg', 'https://prod.pictures.autoscout24.net/listing-images/50fd0c80-2d75-4bca-8ccd-85630454a9ef_c89db3fd-7a5f-4c66-bce9-6e82bfa8d7a6.jpg', 'https://prod.pictures.autoscout24.net/listing-images/50fd0c80-2d75-4bca-8ccd-85630454a9ef_e87ce1df-37b0-4145-bd4c-e88d7d1b0f5a.jpg', 'https://prod.pictures.autoscout24.net/listing-images/50fd0c80-2d75-4bca-8ccd-85630454a9ef_66f8ba7a-06df-4cfd-a658-d060ff600ebb.jpg']",9,"Cava Manara - Pv, IT",,,,Autocarro trasporto bestiame,Usato,,3,4,Italia,,128.000 km,02/2009,84 k W (114 C V),Manuale,,Euro 4,Alzacristalli elettrici Climatizzatore Cruise Control Sensore di luminosità Sensore di pioggia Volante in pelle,C DVivavoce,A BS Airbag conducente Airbag laterali Airbag posteriore Airbag testa Chiusura centralizzata Chiusura centralizzata telecomandata Fendinebbia Servosterzo,,Bianco,,,"€ 0,-",Enthalten,"€ 150,-","€ 150,-",Kilometerleasing,10.000 km,36 Monate,"€ 630,-","4,53 %","4,53 % gebunden","€ 47.880,-",,1,,,1.995 cm³,6,4,,,"€ 22.680,-","2,78","€ 0,0916","€ 0,0417",,Diesel (Filtro antiparticolato),,,"€ 8.000,-",-,"€ 8.000,-","€ 9.848,60","8,87 %","7,70 %","€ 161,06",2009,,,,,1.450 kg,,,,
/annunci/bmw-x1-sdrive18d-xline-diesel-grigio-85262331-54f2-41de-80e2-8088ac0ec836,Lynk & Co,2022-11-22 23:06:03.963153,"['https://prod.pictures.autoscout24.net/listing-images/85262331-54f2-41de-80e2-8088ac0ec836_86496a6f-625d-4af8-a689-53c19bce26f8.jpg', 'https://prod.pictures.autoscout24.net/listing-images/85262331-54f2-41de-80e2-8088ac0ec836_538baa28-8a54-4d66-b862-820a4b26e9b4.jpg', 'https://prod.pictures.autoscout24.net/listing-images/85262331-54f2-41de-80e2-8088ac0ec836_b59da9a3-6c16-4f19-bf8c-d914984ae799.jpg', 'https://prod.pictures.autoscout24.net/listing-images/85262331-54f2-41de-80e2-8088ac0ec836_efe91b09-ce97-49f1-ac87-e7d9e05b5ca4.jpg', 'https://prod.pictures.autoscout24.net/listing-images/85262331-54f2-41de-80e2-8088ac0ec836_35243418-ef83-4b52-b422-088c4e644400.jpg', 'https://prod.pictures.autoscout24.net/listing-images/85262331-54f2-41de-80e2-8088ac0ec836_ceca3654-4371-45c1-897c-f61617dd3062.jpg', 'https://prod.pictures.autoscout24.net/listing-images/85262331-54f2-41de-80e2-8088ac0ec836_b28fcc7b-bf77-485e-aa86-f6993ebbeea9.jpg', 'https://prod.pictures.autoscout24.net/listing-images/85262331-54f2-41de-80e2-8088ac0ec836_fe43c207-8512-4d74-be07-0f93fee94f02.jpg', 'https://prod.pictures.autoscout24.net/listing-images/85262331-54f2-41de-80e2-8088ac0ec836_36630128-eebb-4e56-b9b6-add24214f3b4.jpg', 'https://prod.pictures.autoscout24.net/listing-images/85262331-54f2-41de-80e2-8088ac0ec836_c5861e36-e702-4aa7-83b8-6ae803979d02.jpg', 'https://prod.pictures.autoscout24.net/listing-images/85262331-54f2-41de-80e2-8088ac0ec836_cb2d1184-54b8-4ca1-bae0-97f5fb170505.jpg']",11,"Marano, IT","4,1","4,9","3,7",S UV/Fuoristrada/Pick-up,Usato,Anteriore,5,5,,,37.600 km,01/2018,110 k W (150 C V),Automatico,,Euro 6d,"Alzacristalli elettrici Bracciolo Chiusura centralizzata senza chiave Climatizzatore automatico, 2 zone Cruise Control Head-up display Portellone posteriore elettrico Regolazione elettrica sedili Riscaldamento ausiliario Sedile posteriore sdoppiato Sensore di luminosità Sensore di pioggia Sensori di parcheggio assistito posteriori Sistema di navigazione Specchietti laterali elettrici Start/Stop Automatico Supporto lombare Volante in pelle Volante multifunzione",Autoradio Autoradio digitale Bluetooth CD Computer di bordo Hotspot Wi-Fi MP3 Sound system Streaming musicale integrato Vivavoce,Adaptive Cruise Control Airbag conducente Airbag passeggero Airbag testa Antifurto Assistente abbaglianti Chiusura centralizzata Chiusura centralizzata telecomandata ES PFari L ED Fari bi-Xeno Fari di profondità antiabbagliamento Fari full-L ED Fendinebbia Frenata d'emergenza assistita Isofix Limitatore di velocità Luci diurne L ED Riconoscimento dei segnali stradali Servosterzo Sistema di avviso di distanza Sistema di chiamata d'emergenza Sistema di controllo pressione pneumatici Sistema di riconoscimento della stanchezza,Cerchi in lega Controllo vocale Freno di stazionamento elettrico Leve al volante Luce d'ambiente Portapacchi Sedili sportivi Sospensioni sportive Specchietto retrovisore con funzione antiabbagliamento Touch screen,Grigio,,,"€ 0,-",Enthalten,"€ 190,-","€ 190,-",Kilometerleasing,10.000 km,48 Monate,"€ 198,12","3,53 %","3,47 % gebunden","€ 15.800,-",,,Sì,Sì,1.995 cm³,8,4,1.505 kg,,,,"€ 0,0500","€ 0,0300",,Diesel (Filtro antiparticolato),,,"€ 26.900,-",-,"€ 26.900,-","€ 33.302,40","9,11 %","8,50 %","€ 551,89",,,,06/2022,,,,,,
/annunci/renault-grand-scenic-energy-zen-edc-7-posti-1-5-diesel-110cv-diesel-blu-azzurro-de0db244-5fd1-46d8-91fc-5bf625f71498,Lynk & Co,2022-11-22 23:06:04.637342,"['https://prod.pictures.autoscout24.net/listing-images/de0db244-5fd1-46d8-91fc-5bf625f71498_de95bf6a-adb8-497b-95e5-3bd6a69c9d70.jpg', 'https://prod.pictures.autoscout24.net/listing-images/de0db244-5fd1-46d8-91fc-5bf625f71498_a4b5ffe4-3bc3-4c2c-b7d0-24aa822535a3.jpg', 'https://prod.pictures.autoscout24.net/listing-images/de0db244-5fd1-46d8-91fc-5bf625f71498_633e8347-bbb5-40e8-b5ba-20f4bec3119b.jpg', 'https://prod.pictures.autoscout24.net/listing-images/de0db244-5fd1-46d8-91fc-5bf625f71498_e15d53b2-768f-494f-8817-18c6acf51626.jpg', 'https://prod.pictures.autoscout24.net/listing-images/de0db244-5fd1-46d8-91fc-5bf625f71498_f544eeba-4684-4281-b0c4-8cb4a49c91b1.jpg', 'https://prod.pictures.autoscout24.net/listing-images/de0db244-5fd1-46d8-91fc-5bf625f71498_7e13ed0c-0ae7-4e8d-8f95-fa1a45c43606.jpg', 'https://prod.pictures.autoscout24.net/listing-images/de0db244-5fd1-46d8-91fc-5bf625f71498_a38c8855-3cfb-46aa-a526-449579213946.jpg', 'https://prod.pictures.autoscout24.net/listing-images/de0db244-5fd1-46d8-91fc-5bf625f71498_f746a295-8044-4a61-a0b1-71748f95e96e.jpg', 'https://prod.pictures.autoscout24.net/listing-images/de0db244-5fd1-46d8-91fc-5bf625f71498_e9127230-df19-4632-833f-2771a6b5777b.jpg', 'https://prod.pictures.autoscout24.net/listing-images/de0db244-5fd1-46d8-91fc-5bf625f71498_4b2c1294-44a8-4b99-9053-9038d91d3199.jpg', 'https://prod.pictures.autoscout24.net/listing-images/de0db244-5fd1-46d8-91fc-5bf625f71498_b44531cf-88fa-43cf-b44d-34f45dbd55b0.jpg', 'https://prod.pictures.autoscout24.net/listing-images/de0db244-5fd1-46d8-91fc-5bf625f71498_b468eb0f-af22-4883-8278-f4909153a081.jpg', 'https://prod.pictures.autoscout24.net/listing-images/de0db244-5fd1-46d8-91fc-5bf625f71498_f259a17a-eaf7-4432-b20f-3804a97be451.jpg', 'https://prod.pictures.autoscout24.net/listing-images/de0db244-5fd1-46d8-91fc-5bf625f71498_b1f01777-6c7d-4b3e-bdda-a29fa9bdfef8.jpg', 'https://prod.pictures.autoscout24.net/listing-images/de0db244-5fd1-46d8-91fc-5bf625f71498_4eaaeb8f-108b-4c36-9ca1-1e1185f0fe07.jpg']",15,"Borgaro Torinese - Torino - TO, IT",4,"4,2","3,9",Monovolume,Usato,Anteriore,7,5,,12 mesi,70.502 km,10/2017,81 k W (110 C V),Automatico,,Euro 6,Climatizzatore Controllo automatico clima Volante in pelle,,Chiusura centralizzata Fendinebbia,Cerchi in lega,Blu/Azzurro,Nero,Stoffa,"€ 0,-",Enthalten,"€ 150,-","€ 150,-",Kilometerleasing,10.000 km,36 Monate,"€ 778,-","4,5 %","4,5 % gebunden","€ 59.960,-",,1,,Sì,1.461 cm³,7,4,1.615 kg,,"€ 28.008,-","2,78","€ 0,1261","€ 0,0559",B R160901,Diesel,,Blu,"€ 18.990,-",-,"€ 19.000,-","€ 23.577,60","9,22 %","8,50 %","€ 389,81",,,,,,,,,,
/annunci/opel-crossland-x-1-2-innovation-81cv-gpl-gpl-grigio-00cbdec3-f736-476a-8ce1-02fcac51f7fb,Lynk & Co,2022-11-22 23:06:05.201456,"['https://prod.pictures.autoscout24.net/listing-images/00cbdec3-f736-476a-8ce1-02fcac51f7fb_08ce4450-8ac4-4f39-b1e5-13b4d2c569d2.jpg', 'https://prod.pictures.autoscout24.net/listing-images/00cbdec3-f736-476a-8ce1-02fcac51f7fb_5efef776-6b67-486c-8022-695509b323dd.jpg', 'https://prod.pictures.autoscout24.net/listing-images/00cbdec3-f736-476a-8ce1-02fcac51f7fb_e1164edf-f201-47c6-8f6b-ce680c147562.jpg', 'https://prod.pictures.autoscout24.net/listing-images/00cbdec3-f736-476a-8ce1-02fcac51f7fb_1fb547e7-9644-4348-a05c-9ed78f1fcd94.jpg', 'https://prod.pictures.autoscout24.net/listing-images/00cbdec3-f736-476a-8ce1-02fcac51f7fb_9fcd881a-36eb-4f00-aaab-8c539164b30f.jpg', 'https://prod.pictures.autoscout24.net/listing-images/00cbdec3-f736-476a-8ce1-02fcac51f7fb_1d2312dd-8fc4-4df4-a0d6-ba124255b56b.jpg', 'https://prod.pictures.autoscout24.net/listing-images/00cbdec3-f736-476a-8ce1-02fcac51f7fb_71f2aa3c-770c-406c-94ab-87d2a41b1bde.jpg', 'https://prod.pictures.autoscout24.net/listing-images/00cbdec3-f736-476a-8ce1-02fcac51f7fb_77dc4bed-1011-4423-b7dd-aa698e7449fc.jpg', 'https://prod.pictures.autoscout24.net/listing-images/00cbdec3-f736-476a-8ce1-02fcac51f7fb_41a6020b-2956-4f83-b0e7-9ec315756df4.jpg', 'https://prod.pictures.autoscout24.net/listing-images/00cbdec3-f736-476a-8ce1-02fcac51f7fb_4e319eac-d2a1-476c-9487-0969ee8f3e0c.jpg', 'https://prod.pictures.autoscout24.net/listing-images/00cbdec3-f736-476a-8ce1-02fcac51f7fb_399cb128-3037-4128-80a1-f23473b90b29.jpg']",11,"Cesena, IT","5,1","6,8","4,5",S UV/Fuoristrada/Pick-up,Usato,Posteriore,5,5,,,99.122 km,11/2018,60 k W (82 C V),Manuale,,Euro 6d-T EM P,Alzacristalli elettrici Climatizzatore Cruise Control Hill Holder Sedile posteriore sdoppiato Sensore di luminosità Sensori di parcheggio assistito anteriori Sensori di parcheggio assistito posteriori Telecamera per parcheggio assistito Volante multifunzione,Android Auto Autoradio Autoradio digitale Bluetooth MP3 Schermo multifunzione interamente digitale Sound system US BVivavoce,A BS Airbag conducente Airbag passeggero Airbag testa Chiusura centralizzata Chiusura centralizzata telecomandata Controllo elettronico della corsia ES PFendinebbia Limitatore di velocità Luci diurne Riconoscimento dei segnali stradali Servosterzo Sistema di chiamata d'emergenza Sistema di controllo pressione pneumatici Sistema di riconoscimento della stanchezza,Cerchioni in acciaio Leve al volante Pneumatici da neve Pneumatici estivi Portapacchi Ruotino Touch screen,Grigio,,,"€ 0,-","€ 1.199,-","€ 135,-","€ 1.334,-",Kilometerleasing,10.000 km,48 Monate,"€ 89,-","4,06 %","3,99 % gebunden","€ 4.272,-",,,Sì,Sì,1.199 cm³,5,3,,,"€ 4.272,-","0,56","€ 0,0795","€ 0,0318",,Gas di petrolio liquefatto,111 g/km (comb.),,"€ 12.500,-",-,"€ 12.500,-","€ 15.396,-","8,88 %","8,00 %","€ 253,45",,05/2024,,05/2022,,,,,,
